{
  "$schema": "https://json-schema.org/draft/2020-12/schema",
  "$id": "https://nit.dev/schemas/task.schema.json",
  "title": "Task",
  "description": "A work unit within a phase.",
  "type": "object",
  "properties": {
    "id": {
      "type": "string",
      "pattern": "^TASK-\\d+[a-z]?$",
      "description": "Task identifier (e.g., TASK-001). A split task's parts carry a letter suffix: TASK-001a, TASK-001b."
    },
    "phase": {
      "type": "string",
      "pattern": "^PHASE-\\d+$",
      "description": "Parent phase identifier."
    },
    "title": {
      "type": "string",
      "description": "Short task title."
    },
    "type": {
      "type": "string",
      "enum": ["backend", "frontend", "devops", "qa"],
      "description": "Task type determining the specialist role."
    },
    "targetModule": {
      "type": "string",
      "description": "Module this task targets."
    },
    "status": {
      "type": "string",
      "enum": ["draft", "ready", "in-progress", "review", "done"],
      "description": "Current task status."
    },
    "archetype": {
      "type": "string",
      "description": "Archetype identifier governing the task's step sequence."
    },
    "dependsOn": {
      "type": "array",
      "items": {
        "type": "string",
        "pattern": "^TASK-\\d+[a-z]?$"
      },
      "uniqueItems": true,
      "description": "Tasks that must complete before this one can start. Every id must name a task that exists; `nit validate --schema task` resolves them, and `nit deps` builds the graph from this field. Recording a dependency in prose instead leaves it invisible to both."
    },
    "acceptanceCriteria": {
      "type": "array",
      "items": {
        "type": "object",
        "properties": {
          "id": { "type": "string" },
          "description": { "type": "string" }
        },
        "required": ["id", "description"]
      },
      "description": "List of acceptance criteria for the task."
    }
  },
  "required": ["id", "phase", "title", "type", "status"],
  "additionalProperties": false
}
